{
  "$schema": "https://json-schema.org/draft/2020-12/schema",
  "$id": "https://drod.dev/refresh/schema/v2/UpgradeCheck.json",
  "$defs": {
    "AddonSkew": {
      "properties": {
        "name": {
          "type": "string"
        },
        "version": {
          "type": "string"
        },
        "latest": {
          "type": "string",
          "description": "latest is the latest version compatible with the cluster. It is left out when EKS publishes none."
        },
        "behind": {
          "type": "boolean"
        },
        "incomplete": {
          "type": "boolean",
          "description": "incomplete is true when the add-on or its latest version could not be read."
        }
      },
      "type": "object",
      "required": [
        "name",
        "behind"
      ],
      "description": "AddonSkew is the version of one add-on against its latest compatible version."
    },
    "Failure": {
      "properties": {
        "kind": {
          "$ref": "#/$defs/FailureKind"
        },
        "name": {
          "type": "string",
          "description": "name identifies the item. For a Region failure it is the region."
        },
        "cluster": {
          "type": "string",
          "description": "cluster is the cluster that the item belongs to."
        },
        "region": {
          "type": "string"
        },
        "operation": {
          "type": "string",
          "description": "operation is the IAM action that failed, such as \"eks:DescribeNodegroup\"."
        },
        "reason": {
          "type": "string",
          "examples": [
            "AccessDenied",
            "CredentialError",
            "Throttled",
            "NotFound",
            "RegionUnavailable",
            "InvalidRequest",
            "ServiceError",
            "NetworkError",
            "Timeout",
            "Interrupted",
            "UpdateFailed",
            "UpdateCancelled",
            "NotMonitored",
            "NotAttempted",
            "Unknown"
          ]
        },
        "retryable": {
          "type": "boolean",
          "description": "retryable reports whether the same command, run again with no other change, may succeed."
        },
        "error": {
          "type": "string",
          "description": "error is one line of text for people. Do not parse it; use Reason."
        },
        "awsErrorCode": {
          "type": "string",
          "description": "awsErrorCode is the AWS API error code, such as AccessDeniedException, when AWS answered."
        },
        "updateId": {
          "type": "string",
          "description": "updateId is the EKS update ID, for a failure of a started update."
        }
      },
      "type": "object",
      "required": [
        "kind",
        "name",
        "reason",
        "retryable",
        "error"
      ],
      "description": "Failure is one item that refresh could not read, or one action that it tried and that did not complete."
    },
    "FailureKind": {
      "type": "string",
      "enum": [
        "Region",
        "Cluster",
        "Nodegroup",
        "Addon",
        "Insight",
        "Update",
        "PodDisruptionBudget",
        "Node"
      ],
      "description": "FailureKind is the type of item a Failure is about."
    },
    "Failures": {
      "items": {
        "$ref": "#/$defs/Failure"
      },
      "type": "array",
      "description": "Failures is the failure list of a document. A nil list encodes as [], so a document always has its failures key as a list."
    },
    "HealthOutcome": {
      "type": "string",
      "enum": [
        "Pass",
        "Warn",
        "Fail",
        "Skipped",
        "Unreadable"
      ],
      "description": "HealthOutcome is what a health check found."
    },
    "HealthResult": {
      "properties": {
        "name": {
          "type": "string"
        },
        "outcome": {
          "$ref": "#/$defs/HealthOutcome"
        },
        "blocking": {
          "type": "boolean",
          "description": "blocking is true when a Fail of this check blocks a change."
        },
        "message": {
          "type": "string",
          "description": "message is one line about what the check found."
        },
        "details": {
          "items": {
            "type": "string"
          },
          "type": "array"
        },
        "findings": {
          "items": {
            "type": "string"
          },
          "type": "array",
          "description": "findings name the things behind a Warn or a Fail, such as the nodes that are not ready."
        }
      },
      "type": "object",
      "required": [
        "name",
        "outcome",
        "blocking",
        "message",
        "details",
        "findings"
      ],
      "description": "HealthResult is the result of one health check."
    },
    "Insight": {
      "properties": {
        "id": {
          "type": "string"
        },
        "name": {
          "type": "string"
        },
        "category": {
          "type": "string"
        },
        "status": {
          "type": "string",
          "description": "status is the EKS value: PASSING, WARNING, ERROR, or UNKNOWN."
        },
        "statusReason": {
          "type": "string"
        },
        "kubernetesVersion": {
          "type": "string",
          "description": "kubernetesVersion is the version that the insight is about."
        },
        "lastRefreshTime": {
          "type": "string",
          "format": "date-time"
        },
        "description": {
          "type": "string"
        }
      },
      "type": "object",
      "required": [
        "id",
        "name",
        "category",
        "status"
      ],
      "description": "Insight is one EKS cluster insight."
    },
    "InsightCounts": {
      "properties": {
        "passing": {
          "type": "integer"
        },
        "warning": {
          "type": "integer"
        },
        "error": {
          "type": "integer"
        },
        "unknown": {
          "type": "integer"
        }
      },
      "type": "object",
      "required": [
        "passing",
        "warning",
        "error",
        "unknown"
      ],
      "description": "InsightCounts counts insights by status."
    },
    "NodegroupSkew": {
      "properties": {
        "name": {
          "type": "string"
        },
        "version": {
          "type": "string"
        },
        "minorsBehind": {
          "type": "integer",
          "description": "minorsBehind is how many minor versions the nodegroup trails the control plane."
        },
        "atSkewLimit": {
          "type": "boolean",
          "description": "atSkewLimit is true when the nodegroup is at the kubelet skew limit: the next upgrade of the control plane would put it past it."
        },
        "incomplete": {
          "type": "boolean",
          "description": "incomplete is true when the nodegroup could not be read."
        }
      },
      "type": "object",
      "required": [
        "name",
        "minorsBehind",
        "atSkewLimit"
      ],
      "description": "NodegroupSkew is the version of one nodegroup against the control plane."
    },
    "Readiness": {
      "type": "string",
      "enum": [
        "Ready",
        "Review",
        "Blocked",
        "Incomplete"
      ],
      "description": "Readiness is the verdict of \"refresh cluster upgrade-check\"."
    },
    "Rollback": {
      "properties": {
        "previousVersion": {
          "type": "string"
        },
        "upgradedAt": {
          "type": "string",
          "format": "date-time",
          "description": "upgradedAt is when the upgrade to the current version started. EKS counts the window from when it finished, so the dates are approximate."
        },
        "availableUntil": {
          "type": "string",
          "format": "date-time"
        },
        "insights": {
          "$ref": "#/$defs/InsightCounts",
          "description": "insights counts the ROLLBACK_READINESS insights by status. It is left out when they could not be read."
        }
      },
      "type": "object",
      "required": [
        "previousVersion",
        "upgradedAt",
        "availableUntil"
      ],
      "description": "Rollback says that the cluster can roll back to its previous minor version, and until when."
    },
    "Skew": {
      "properties": {
        "controlPlaneVersion": {
          "type": "string",
          "description": "controlPlaneVersion is the Kubernetes minor version of the cluster."
        },
        "nodegroups": {
          "items": {
            "$ref": "#/$defs/NodegroupSkew"
          },
          "type": "array"
        },
        "addons": {
          "items": {
            "$ref": "#/$defs/AddonSkew"
          },
          "type": "array"
        }
      },
      "type": "object",
      "required": [
        "controlPlaneVersion",
        "nodegroups",
        "addons"
      ],
      "description": "Skew is the version skew of a cluster: its nodegroups against the control plane, and its add-ons against their latest compatible version."
    },
    "Support": {
      "properties": {
        "tier": {
          "$ref": "#/$defs/SupportTier"
        },
        "standardUntil": {
          "type": "string",
          "format": "date-time"
        },
        "extendedUntil": {
          "type": "string",
          "format": "date-time"
        },
        "daysRemaining": {
          "type": "integer",
          "description": "daysRemaining is the days until the tier ends, with a part of a day as a whole day. It is left out when no window is open."
        },
        "autoUpgrade": {
          "type": "boolean",
          "description": "autoUpgrade is true when the upgrade policy of the cluster is STANDARD: EKS upgrades it at the end of standard support, and it never enters extended support."
        },
        "builtIn": {
          "type": "boolean",
          "description": "builtIn is true when the dates are the ones that refresh ships with, because EKS did not report them."
        }
      },
      "type": "object",
      "required": [
        "tier",
        "autoUpgrade",
        "builtIn"
      ],
      "description": "Support is the support window of the Kubernetes version of a cluster."
    },
    "SupportTier": {
      "type": "string",
      "enum": [
        "Standard",
        "Extended",
        "Unsupported",
        "Unknown"
      ],
      "description": "SupportTier is where the Kubernetes version of a cluster is in its EKS support window."
    }
  },
  "properties": {
    "apiVersion": {
      "type": "string",
      "const": "refresh.drod.dev/v2",
      "description": "The version of the document contract."
    },
    "kind": {
      "type": "string",
      "const": "UpgradeCheck",
      "description": "The type of the document."
    },
    "cluster": {
      "type": "string"
    },
    "region": {
      "type": "string"
    },
    "version": {
      "type": "string",
      "description": "version is the Kubernetes minor version of the control plane."
    },
    "readiness": {
      "$ref": "#/$defs/Readiness"
    },
    "reasons": {
      "items": {
        "type": "string"
      },
      "type": "array",
      "description": "reasons are the findings behind the readiness, worst first."
    },
    "support": {
      "$ref": "#/$defs/Support"
    },
    "insights": {
      "items": {
        "$ref": "#/$defs/Insight"
      },
      "type": "array",
      "description": "insights are the EKS cluster insights of the category, as --status and --show-passing filter them."
    },
    "insightsEvaluated": {
      "type": "boolean",
      "description": "insightsEvaluated is false when EKS returned no insight of the category at all, passing ones included: it has not evaluated the cluster yet."
    },
    "checks": {
      "items": {
        "$ref": "#/$defs/HealthResult"
      },
      "type": "array",
      "description": "checks are the readiness checks: the insights, the version skew, and the control plane."
    },
    "skew": {
      "$ref": "#/$defs/Skew"
    },
    "rollback": {
      "$ref": "#/$defs/Rollback"
    },
    "failures": {
      "$ref": "#/$defs/Failures",
      "description": "Every failure of the run: the items that refresh could not read and the actions that did not complete. The list is sorted by kind, region, cluster, name, and operation. It is [] when there are no failures."
    }
  },
  "type": "object",
  "required": [
    "apiVersion",
    "kind",
    "cluster",
    "region",
    "readiness",
    "reasons",
    "insights",
    "insightsEvaluated",
    "checks",
    "failures"
  ],
  "title": "UpgradeCheck",
  "description": "The document that `refresh cluster upgrade-check -o json` prints. -o yaml prints the same structure."
}
